51,10268,Men,Footwear,Shoes,Formal Shoes,Black,Fall,2012,Formal,Clarks Men Hang Work Leather Black Formal Shoes
54,59435,Men,Footwear,Shoes,Formal Shoes,Black,Summer,2012,Formal,Arrow Men Black Formal Shoes
64,22198,Men,Footwear,Shoes,Casual Shoes,Black,Fall,2012,Casual,Timberland Men Black Casual Shoes
65,29570,Men,Footwear,Shoes,Casual Shoes,Purple,Summer,2012,Casual,Vans Men Classic Slip-On Purple & Black Shoes
69,26538,Men,Footwear,Shoes,Casual Shoes,Red,Fall,2012,Casual,ID Men Red Shoes
71,49495,Men,Footwear,Shoes,Casual Shoes,Khaki,Summer,2012,Casual,Vans Men Khaki Shoes
89,33822,Men,Footwear,Shoes,Sports Shoes,White,Summer,2012,Sports,Puma Men Axis White & Grey Sports Shoes
103,42089,Men,Footwear,Shoes,Sports Shoes,White,Summer,2012,Sports,ADIDAS Men White Corona Sports Shoes
105,49461,Men,Footwear,Shoes,Casual Shoes,Blue,Summer,2012,Casual,Vans Men Blue Era Scilla Plaid Shoes
109,34835,Men,Footwear,Shoes,Sports Shoes,Blue,Summer,2012,Sports,ADIDAS Men Blue Chill Sports Shoes
